review_description,bug_category,review_date,appVersion
crashing during the login,Login Error,2021-05-01 13:36:04,1.0.4
after update it can t open,Update Issue,2021-04-10 16:10:11,1.2.2
after the last update i m unable to login,Login Error,2021-04-15 09:16:32,1.2.2
app crashed just after login can t do anything,Login Error,2021-04-24 18:29:15,1.2.2
keeps on crashing,Crash/Freeze,2021-04-24 20:24:22,1.2.2
cannot update,Update Issue,2023-08-21 15:32:20,1.7.0
can t log in to the app every time error messages coming,Login Error,2020-05-31 19:02:45,1.0.0
can t even log in properly,Login Error,2025-03-14 11:56:38,2.0.8
after update app suddenly closed tried to completely uninstalled and reinstalled but problem still persit,Update Issue,2021-04-12 18:22:28,1.2.2
doesn t work after update,Update Issue,2021-04-11 18:06:53,1.2.2
cant login,Login Error,2020-05-28 19:40:27,
not working properly when ever i log in and it s says broken connection,Login Error,2021-10-04 21:54:14,1.3.2
not loading the data usage giving me a error tried log out and log in also tried clearing data and cache and log in but still have the error,Login Error,2023-05-31 10:52:57,1.6.1
app keep crashing,Crash/Freeze,2022-12-23 10:15:41,1.5.4
app crashed as soon as i installed and opened it,Crash/Freeze,2021-05-31 14:43:51,1.3.2
after the update app automatically log off my account now i cannot log in again,Login Error,2021-04-27 07:21:54,1.2.2
app gets forced closed when loading dash board after login before the update it was working fine,Login Error,2021-04-16 07:11:17,1.2.2
very bad cannot log in,Login Error,2020-11-05 22:34:28,
keep crashing i need some solution please,Crash/Freeze,2021-04-25 21:01:22,1.2.2
app not working after updated its stucks,Crash/Freeze,2021-04-07 05:28:47,1.0.9
cannot even log in to the app shows as invalid password but even if i reset it still doesn t work,Login Error,2021-09-19 23:49:10,1.3.2
the app is crashing at the start,Crash/Freeze,2021-04-14 06:58:04,1.2.2
data not loading after login,Login Error,2021-10-12 12:58:01,1.3.2
internal server error,Server Error,2024-05-29 08:04:35,1.8.0
i am unable to login even after entering all required credential not the best of experiences,Login Error,2021-08-21 17:18:14,1.3.2
can t login it says no internet connection,Login Error,2020-05-27 09:45:10,1.0.0
cant even login,Login Error,2021-10-15 14:27:09,1.4.1
cant even login,Login Error,2021-03-15 13:17:04,1.0.6
app is not stable sometimes app does not loading,Slow Performance,2024-03-31 20:21:46,1.7.0
it cannot update and even open the previous app give me a solution plz,Update Issue,2021-10-13 10:52:52,1.4.1
unable to login it says incorrect user name password even though i entered the right one unable to reset the password,Login Error,2022-07-06 13:23:10,1.4.2
app is not working after the latest update,Update Issue,2021-04-12 11:52:28,1.2.2
very difficult to log in,Login Error,2024-11-23 09:50:50,2.0.2
after latest update we can t login no use of using this,Login Error,2021-04-10 12:53:42,1.0.9
app is not working after the update,Update Issue,2021-04-06 19:57:59,1.0.9
can t login to this app,Login Error,2021-09-29 09:56:07,1.3.2
can t login to this,Login Error,2021-05-31 14:11:18,1.3.2
i created an account but can t log in it said invalid username or password after create the account,Login Error,2021-09-06 15:58:08,1.3.2
what in the world is wrong with this app always crashing always showing an error message,Crash/Freeze,2024-02-14 12:58:01,1.7.0
can t pay my bill session timeout error appear every time at the end,Payment Issue,2021-07-05 13:18:54,1.3.2
i can t log into the app at the moment keep coming error message which is i m not connected to the internet but i m already connected to the internet and i can do other stuff eg youtube surf,Login Error,2020-05-25 06:12:51,1.0.0
system error is displayed every time when i want to subscribe or unsubscribe a package can t do anything through the app,UI Issue,2025-04-22 20:22:39,2.1.0
i cannot log in to app changed the password but still it says log in info wrong,Login Error,2021-08-06 05:30:15,1.3.2
app is crashing every single time i try to log in through facebook and showing a alert by my phone it has a bug,Login Error,2022-12-10 20:38:03,1.5.4
it says to update but not updating,Update Issue,2023-08-26 10:01:51,1.7.0
can t log in to the app error says there must be only 10 digits to a user name,Login Error,2021-05-10 14:45:39,1.2.8
something is wrong with the app every time i tried to login for the past two days an error msg pops up saying the service is temporarily unavailable,Login Error,2021-08-25 19:35:59,1.3.2
can t login or create new account no network error appears though connected through the fibre frustrating worst app,Login Error,2023-02-03 14:50:23,1.6.0
failing app,Payment Issue,2021-04-22 20:16:04,1.2.2
app crashes on start worst app so far,Crash/Freeze,2021-04-18 13:15:08,
app gets stuck frequently,Crash/Freeze,2024-05-24 16:06:10,1.8.0
couldn t sign in it says to type 10 digit password even after i type my 10 digit password,Login Error,2023-08-19 10:47:11,1.7.0
app keeps crashing i could never use the app i am using a samsung galaxy note 9 android version 8 1 0,Crash/Freeze,2021-04-17 18:00:50,1.2.2
why i can t open some apps through this connection,Other,2023-04-30 00:00:51,1.6.1
update issue please fix it,Update Issue,2023-08-18 10:38:05,1.7.0
app crashed everytime when i try to start up redmi note 7,Crash/Freeze,2021-05-01 11:24:31,1.2.8
it worked alright for like two weeks and now suddenly the app started to crash with a message account details not available please watch out this issue,Crash/Freeze,2020-06-18 10:53:25,1.0.0
cannot sign up using google or credentials,Login Error,2021-05-31 11:31:28,1.3.2
can t login to the account it says my number is wrong,Login Error,2020-05-18 10:13:52,1.0.0
cannot activate packages throws internal server error,Server Error,2024-05-27 18:02:20,1.8.0
garbage even cannot log into the account and see the details,Login Error,2025-04-28 19:25:33,2.1.0
says internal error all the time when i go to check daily usage no update available have cleared cache even tried reinstalling,Update Issue,2024-02-11 12:21:50,1.7.0
when i try to login i m getting sorry for the inconvenience caused service will be available soon message when will be the service available again when will be this issue resolve,Login Error,2023-12-05 22:16:11,1.7.0
one of the wrost app can t login fix all these isssue no star should be given,Login Error,2021-06-15 12:57:15,1.3.2
upgrades are not handled well had two connections configured but now can t select,Other,2022-10-06 20:57:25,1.0.6
cannot sign in with fb,Login Error,2023-11-22 21:44:30,1.7.0
cannot log in to the app typical government service,Login Error,2020-05-14 17:28:17,1.0.0
this app always shows me 2 messages 1 internal server error 2 system error idk how to deal with these intrusive errors,Server Error,2025-01-16 21:16:06,2.0.8
app is fully failure,Payment Issue,2021-05-01 07:59:49,
cant register new connection,Other,2021-09-03 14:38:35,1.3.2
app randomly gives errors like oops something went wrong and service unavailable and it disappear after reloading the app fix that issue also improve the app loading time,Slow Performance,2024-01-03 21:42:44,1.7.0
updated features app crash,Crash/Freeze,2021-04-09 07:41:50,1.2.2
always not responding,Crash/Freeze,2024-05-21 21:40:26,1.8.0
can t pay money with new update fix it,Update Issue,2021-04-18 13:38:49,1.2.2
all of a sudden i can t login into the app you though my internet connection is available app is issuing error messages saying no internet,Login Error,2020-05-27 09:14:17,1.0.0
i can not download bill please fix this issue,Payment Issue,2025-02-24 18:23:39,2.0.8
cannot login with the same credentials i use to login to the web portal useless,Login Error,2022-05-11 16:07:48,1.4.2
useless unable to update,Update Issue,2023-08-25 16:11:20,
when logging to the app probably we are indicated error notification,Notification Problem,2023-08-26 05:13:47,1.7.0
i can t even change data add on package when i try to change it the app show system error notification,Crash/Freeze,2023-04-12 20:27:48,1.6.1
i can t even add on data and change the package either,Crash/Freeze,2021-09-18 12:55:49,1.3.2
fix the logging system was interrupted icant log in my user id,Login Error,2020-05-06 23:39:58,1.0.0
when opened requests a update but playstore has no updates,Update Issue,2023-08-24 16:56:06,1.7.0
can t make a payment,Payment Issue,2021-04-16 08:16:27,1.2.2
can t login with old credentials can t create new a new account cab t reset password allways says service will be available soon,Login Error,2021-05-31 13:37:36,1.3.2
protocol report doesn t display it tries to load up the contents but fails and end up with a blank screen,UI Issue,2023-07-12 06:10:20,
this is not working screen says the service temporary unavailable,UI Issue,2020-06-16 10:16:01,1.0.0
can t do payments,Payment Issue,2021-09-03 13:15:17,
cant add on data on app its not showing the adding data volume and its freeze please fix the bug,Crash/Freeze,2024-04-30 10:42:27,1.8.0
good app after the new update but sevice unavailable error is showing always,Update Issue,2021-06-01 08:56:22,1.3.2
says no internet and doesn t connect,Other,2023-04-26 06:24:29,1.6.1
it doest sign in i repeatedlt checked my user id and pw entered 100 correct but keep on rejecting error says need 10 diguts,Login Error,2021-08-02 23:49:15,1.3.2
app doesn t work properly sometimes it lags and says services temporarily unavailable,Slow Performance,2024-05-22 11:38:04,1.8.0
there are so many errors display when loging very very disappointed,Login Error,2023-12-26 10:57:30,1.7.0
bad signal poor connection,Other,2024-05-12 17:26:20,1.7.0
keep asking to update even after i updated to the latest version,Update Issue,2023-08-18 22:41:24,1.7.0
the current update is so buggy and unresponsive half the time it says service temporarily unavailable,UI Issue,2023-05-31 20:53:34,1.6.1
do not do force update it always blocks user action when there is a connectivity issues and there s no data to update very inconvenient,Update Issue,2024-12-02 12:26:59,2.0.2
slow and asks me to update even though i am upgraded to the latest,Slow Performance,2023-08-25 11:11:14,1.7.0
samsung j7 prime app crash automatically wrost app,Crash/Freeze,2021-05-01 10:46:52,1.0.6
too many bugs and the app crashes way too often,Crash/Freeze,2025-04-28 20:25:06,2.0.8
cannot log in to my account says the number needs to be in 10 digits when typed with 94 but when i try with 0 it says invalid mobile no format i need to know how much data i ve left what should i do is something wrong with the app or,Login Error,2022-07-23 10:13:32,1.4.2
every time i open the app it s either very slow or unresponsive,UI Issue,2024-02-14 13:59:31,1.7.0
cannot use it says no service available,Other,2023-11-21 06:34:53,1.7.0
whenever i open the app it says update available when i click update it redirects to play store but does not update at all instead shows uninstall open can the develper s please explain how to update,Update Issue,2023-08-19 09:38:15,
now always saying your transaction was unsuccessfully please try again,Payment Issue,2023-04-10 12:41:34,1.6.1
cannot even add my connection it says service temporary unavailable,Other,2024-05-08 15:39:41,1.8.0
i cant update my contact information popup says sorry the service temporary unavailable since 3 days i cant change my mail,Crash/Freeze,2025-04-08 12:45:33,2.0.8
after latest update app is hell lot of slow and taking forever to load and doesnt load anything at the end too the app is broken,Slow Performance,2021-04-07 08:15:17,1.0.9
after bill payment no receipt lot of bugs very bad,Payment Issue,2023-12-28 21:38:40,1.7.0
i can t type one time password when i trying to pay the bill,Payment Issue,2021-04-22 20:39:44,1.2.2
can t change wifi password,Crash/Freeze,2022-10-09 21:35:20,1.5.2
can t login it says no internet while i m connected to slt fiber connection test the app before release,Login Error,2020-06-07 21:48:09,1.0.0
worst app ever seen every time i go to pay the bill an error message appears,Payment Issue,2022-09-22 21:28:06,1.4.2
its really bad it s not working i can t log into it it s says oops something went wrong check you data i m so mad even i have data it s say this again but again you have to fix it before i uninstall it,Login Error,2021-07-09 09:28:39,1.3.2
application isn t working correctly and when i was trying to log in to the app and i entered username and password correctly application responded me need 10 digits please fix this issue your customer service so disappointed,Login Error,2021-07-16 00:47:29,1.3.2
5 5 i m trying to get the new update but it only shows update but not updating,Update Issue,2023-08-19 21:33:21,1.4.2
upgraded to new version now the app is giving many errors unable to see at least data usage old version worked untill it was upgraded please lookin to thus matter as sooner due to this i am botable ro activate youtube free offer also,Update Issue,2023-02-02 20:09:27,1.6.0
visa card payments not working,Payment Issue,2022-06-24 15:42:31,1.4.2
not loading on mobile data,Slow Performance,2024-05-25 23:19:03,1.8.0
worst app ever i cannot even log into my account,Login Error,2022-07-25 13:35:18,1.4.2
slt kaspersky page is not working at least can t login to my account to verify with slt kaspersky please fix this,Login Error,2023-11-05 03:01:34,1.7.0
account user name invalid error not working this app properly for last update i have a log time account bad online service bad service not working authorities username and password not capture lol plz give this app develope for professional developeer,Update Issue,2023-03-03 00:12:36,1.6.1
after getting the latest update of the app app does not work properly data usage details and other features are not shown and always pop up error message something when to wrong,Update Issue,2023-05-30 10:46:50,1.6.1
some times comming server error problem this app also like our government,Server Error,2024-04-23 22:24:58,
always service temporarily unavailable app is not working after the update does anyone know the email id to raise complaint,Update Issue,2021-04-26 08:27:29,1.2.2
poor connection don t activite any data plans,Other,2024-04-13 22:08:24,1.5.2
worst app always crashes,Crash/Freeze,2021-04-06 23:43:29,1.0.9
one of the worst application cannot resend the bill request and cannot lodge a complaint the location cannot be added,Payment Issue,2022-11-05 14:02:52,1.5.2
bad services unable to pay even bill also,Payment Issue,2022-05-27 16:17:49,
sri lanka has the worst ever internet connection apps it wont let me login saying wrong password it took me 1 hour and 30 min to log in then it worked fine for a week and it didnt open and its stuck in a white loading screen,Login Error,2022-08-06 13:02:08,1.4.2
payment method does not work,Payment Issue,2021-04-17 13:30:49,1.2.2
myslt app is not working properly needs an urgent update to fix these issues,Update Issue,2024-08-21 10:13:34,1.8.0
nothing can be done other than paying bills and even it doesn t show the activated services every time error message is indicating in complains,Payment Issue,2021-12-15 20:30:39,1.4.2
it crash always,Crash/Freeze,2021-06-01 00:38:15,1.3.2
online payment not working,Payment Issue,2022-05-30 19:41:30,1.4.2
it doesnt show other connections after update i usually use 3 connections,Update Issue,2022-10-10 10:10:26,1.5.2
how do i log into my account try sevaral times called your hotline the way they are saying not working i cannot pay bills due to the covid very poor service,Login Error,2021-08-23 03:42:13,1.3.2
just awful always says connection error and only shows me the current usage can t do anything other than that this happened to me on multiple devices and my connection is perfectly fine the app is just awful,Server Error,2023-02-19 03:12:00,1.4.2
i ve been trying to log into my account but it showed sorry for the inconvenience caused service will be available soon i contacted the slt hotline after waiting for almost 16 minutes but they couldn t fix that problem either disappointed please give the old app back,Login Error,2022-07-07 20:05:25,
worst app only white screen appears,UI Issue,2024-09-06 23:07:44,
can not login with your personal informations of slt package mad verification system,Login Error,2020-04-14 07:07:39,1.0.0
horrid app cannot pay bill and cannot even complain does not work properly,Payment Issue,2023-08-24 16:53:26,
failed,Payment Issue,2021-07-10 14:03:49,1.3.2
worst app ever always the service is unavailable can t view data balance and bills pls fix this error,Payment Issue,2023-05-30 22:15:49,1.6.1
oh boi crashed everytime,Crash/Freeze,2022-01-20 11:39:25,1.4.2
one of the most annoying apps crashes all the time even when your trying to check the basic information slt pls fix app asap no point prompting it in all media channels if you can t deliver,Crash/Freeze,2021-09-01 20:39:40,1.3.2
you have to get a master s degree in myslt app to just login and after when you login it says sorry there s a error try again later and it shows lies about data usage,Login Error,2024-01-04 12:05:28,1.7.0
app not works all the time mostly getting service temporary unavailable notification,Notification Problem,2023-04-10 08:36:12,1.6.1
i hv unlimited flash 5 package and this app doesn t update data usage in real time actually after the 7 days of starting the new quota it still shows usage as zero,Update Issue,2022-08-14 17:43:07,1.4.2
what s with the app after the update it s not working service unavailable,Update Issue,2023-02-02 13:16:09,
something wrong with my app showing to update but not updating or not working also informed to slt but still the same no problem with the phone other apps working,Update Issue,2021-10-16 00:52:48,1.3.2
can t change contact information,Crash/Freeze,2025-04-18 18:39:08,
can t change contact information,Crash/Freeze,2025-04-10 22:21:32,2.0.8
updated the app it cannot be used to check and pay bills as an error message comes up,Payment Issue,2023-02-02 10:56:14,1.6.0
my payment isn t getting processed,Payment Issue,2022-06-14 13:41:58,1.4.2
doesn t let get any data add on packs doesn t respond to touch inputs update it was solved after sometime don t know how it happened,Update Issue,2022-07-07 18:46:23,
i actually can t remember my password to login to my broadband account and there s no option to reset the password as well therefore i don t get any updates on my wifi usage please look into this matter and get back to me,Login Error,2022-08-24 15:29:13,1.4.2
really bad i try to sign and always pop up invalid passwor or user name and also my father went slt gampaha branch to create slt account to phone the branch members are also even dont know how to create the account finally we decided to switch again to dialog such a biggest company failed to create app for customers really bad and wrost,Payment Issue,2021-05-15 10:41:05,
user interface is full of shi cant even log in to acc,Login Error,2022-07-08 00:56:07,1.4.2
useless connection very slow,Slow Performance,2020-05-02 11:03:32,1.0.0
some channel at peo tv are disconnected,Other,2023-08-12 20:07:32,
bill payment page not fill my account number but show that previous page and when enter telephone number it getting error wrong telephone number so how to pay,Payment Issue,2022-08-27 18:34:29,1.4.2
update was bad,Update Issue,2021-10-14 07:04:09,1.3.2
no way to reload prepaid connection,Other,2024-01-01 16:24:43,
this app always get crashed when i try to pay bill through this app it always shows that my number is wrong please give a hint on required format so that it is not confusing there are lots of options but very few is working,Crash/Freeze,2022-01-13 08:44:45,1.4.2
after the last update connection change dropdown is not visible at the top please fix it,Crash/Freeze,2023-01-12 19:08:06,1.5.4
very very bad signal strength can t do anything wifi is not connecting hopeless service,Other,2021-10-28 18:35:14,1.4.1
can t pay ebill can t type otp number please fix this,Payment Issue,2021-04-24 22:05:57,1.2.2
i cleared all the amounts in bills but still the service is barred,Payment Issue,2023-02-18 13:12:24,1.6.1
worst app ever currently the app displays service temporarily unavailable not only now for the past 2 or 3 weeks i am having this issue,UI Issue,2023-08-11 11:17:49,1.6.1
hopeless app always sign in issues and not at all user friendly,Login Error,2024-11-15 21:51:34,2.0.2
change contact information is not working,Crash/Freeze,2025-04-25 07:50:24,2.1.0
i cant pay my e bill using app previous month it works but now its doesnt work,Payment Issue,2022-06-28 20:35:00,1.4.2
can t even pay the bill anymore,Payment Issue,2022-09-09 13:08:35,1.4.2
this app doesn t work old app didn t accept my user credentials all of a sudden i uninstalled that and trying to install this but can t install,Login Error,2022-07-07 23:35:47,
i cant add pakages in our wifi connection it always says server error when we try to add pakages specially when we try to add youth add on and youtube pakage it accepts once in every 100 attempts rarely since we couldnt activate those pakages via call this is a big head ache to us a spcial note is that all the mobiles that are logged in my slt app are showing the same internal server error issue we also changed our router once but still the problem is not cured this is happening since a year,Crash/Freeze,2023-08-21 17:45:44,1.7.0
we can t use the app if the connection is disconnected i wanted to file a complaint through the app but getting the error the connection is bot active despite making the full settlement,Other,2023-11-05 16:47:52,1.7.0
app is not stable very slow response,Slow Performance,2021-06-01 00:58:32,1.3.2
there are so many bugs and crashes this app doesn t works properly,Crash/Freeze,2021-06-01 10:40:33,1.3.2
data usage doesn t update,Update Issue,2024-02-17 04:50:03,1.7.0
pre paid connection can not add fix it quickly,Other,2023-07-08 21:06:40,1.6.1
so many bugs cant even log in to the account so annoying worst app ever,Login Error,2020-12-29 18:09:23,1.0.6
can t even send a complaint can t update number can t even pay as with everything else slt you tell them take your money and they say no thanks,Update Issue,2022-05-29 16:58:31,1.4.2
the ac password change otp takes days to respond they are not managing the app with right tools,Crash/Freeze,2024-07-06 21:10:36,1.8.0
stupid f app slow loading time wasting app uninstalled,Slow Performance,2021-10-09 02:25:55,
it s don t display my security details,UI Issue,2023-09-27 07:49:06,1.7.0
i yes it very good but now it ask for update when i choose to update update continue when open the app again update message come again what i have to do,Update Issue,2021-10-20 18:58:55,
installed the app still waiting for the otp to sign up been almost 5 minutes,Slow Performance,2023-08-07 19:58:19,1.6.1
so basically you guys taking out the working app and replacing to a broken app ggwp cant even login what a joke,Login Error,2022-07-02 20:35:51,
not good one more times loading and finally says ooops something went wrong i fish they resolve this bugs,Slow Performance,2023-02-04 07:43:09,1.6.0
it looses all account data when update worse app,Update Issue,2021-12-31 09:35:48,1.4.2
useless app each time i log into the appa oops something s wrong no details are shown no point in using this,Login Error,2020-10-02 10:51:08,1.0.4
the real time update isn t working past three days it shows the same usage got screenshot of the display for evidence,UI Issue,2024-04-17 11:27:05,
the app isn t even working properly i can t view my bill and i can t pay as well tried registering to the online billing service but that seems to crash as well the app needs some serious attention and maintenance,Crash/Freeze,2021-06-01 06:49:09,1.3.2
payment system issue,Payment Issue,2023-01-13 13:36:29,1.5.4
her wifi isn t working,Other,2020-07-15 22:22:37,
what is wrong with the devs bro fix the bugs telling error in information update is not bug fixing disappointed af worst app ever and slow as christmas,Slow Performance,2025-04-22 19:52:34,
cannot add promo codes please check the character length validation of the promo code field redeem button is disabled even after adding the promo code,UI Issue,2022-07-12 19:42:51,1.4.2
tried to check the bills no response,Payment Issue,2022-09-08 16:11:46,
i am trying to login to the app for the past three days there is no direction on how to do this called 1212 and i got three different set of instructions and after trying all of that now it says account locked for 24 hrs what a joke i did not even log into the app and it is already locked sent an email to 1212 mail and they are also not replying is this ur level of service slt such a shame,Login Error,2021-07-26 23:41:39,1.3.2
complain section logic bill system reconnect erro service barred 1212 service complain online app low pay bill complain submit logic,Payment Issue,2024-02-06 13:18:04,1.7.0
online payment gateway doesn t work,Payment Issue,2020-06-24 20:46:52,1.0.0
the online payment method doesn t work it even send the code for your for phone but after entering it notification is received saying something went wrong i tried 5 different cards,Payment Issue,2020-05-14 13:47:08,1.0.0
i would like to report a bug in the broadband log in flow of myslt app according to 1212 officers i should be able to use the same credentials as slt broadband app but each time i tried it says invalid user name or password tried to explain the scenario to the 1212 officer and she was resetting my password over and over then i sent an email to 1212 they also has done a password reset and shared me the password at least hope this account is managed by the dev team,Login Error,2022-05-23 11:59:12,1.4.2
