review_description,bug_category,review_date,appVersion
i was using this app my bill is also linked to it however my details were automatically deleted and then i tried to enter my telephone number account number and my id but i got an error message saying my id is wrong,Payment Issue,2025-01-06 13:02:04,2.0.8
tried to change package gets an internal error message honestly why do you even bother stay in the stone age like you used to slt,Crash/Freeze,2021-07-15 13:35:57,1.3.2
why isn t service upgrade features doesn t work i need to upgrade my adsl connection to fiber connection,Other,2020-07-09 11:57:36,1.0.4
i just paid the november month bill thru this app and ended up getting freezed but the amount for deducted from the bank account the app is really useless garbage since app getting freeze during payment is horrible i need an immediate solution,Crash/Freeze,2023-12-02 23:30:33,1.7.0
dose not updated payment details,Payment Issue,2021-05-01 21:10:47,1.2.8
there is a problem with this app in the new update it does not show two accounts it was shown in the previous version,Update Issue,2022-11-04 08:53:02,1.5.2
it s been months since i have downloaded this app but still unable to login to my broadband account disappointed,Login Error,2022-08-16 08:03:35,1.4.2
i am unable to get my data balance of my prolink connection,Other,2021-06-07 06:01:05,1.3.2
requested a package upgrade from web pro to any storm 2 days after the request package change didn t take affect so had to call them to request the upgrade than then they have upgraded it to the wrong package web master which costs 2000 rupees more and denies that they ve received upgrade requests through the app saying to which specific package i wanted upgraded to even tho says request pending when i try to send the upgrade request again terrible app terrible service,Crash/Freeze,2021-09-23 12:35:16,1.3.2
why the remaining data is not displayed for unlimited flash 10 users,UI Issue,2024-11-08 20:51:17,2.0.2
totally worst app it s servers still showing error we could not unsubscribe some data automatically increased my bill payment value,Payment Issue,2021-08-03 20:14:19,1.3.2
app is always doesn t work i am unable to upgrade my package and pay my bill not recommending worst app,Payment Issue,2021-09-01 00:48:33,1.3.2
worst app i can t log in to my broadband account via this it says failed to load not a smooth app totally disappointed,Login Error,2022-08-03 17:58:26,1.4.2
this app is complete garbage i got a new fibre connection after days of them bugging us and now after i reinstalled the app under their instructions i cannot add in my existing account and check details anymore,Other,2024-07-05 00:46:38,1.8.0
this app is full of errors the app is not working and i can t see my data balance can t even perform a simple task inside the application can only view the payment amount don t waste your time,Payment Issue,2024-08-21 08:37:14,1.8.0
bill details are not showing now,Payment Issue,2020-05-20 15:07:00,1.0.0
we cannot view bill at anytime its taking more than two weeks to fix our bill but they debit it to our account very bad service,Payment Issue,2024-03-07 20:14:33,
very bad becuse this new update it isnt work,Update Issue,2024-11-27 09:26:03,1.8.0
worst app when i try to add my slt username it say fail to add slt data,Payment Issue,2021-06-21 15:31:57,1.3.2
can t pay the bill online,Payment Issue,2021-04-29 09:02:47,1.2.8
unable to view remaining data buy extra gb package details it keeps prompting a message to change the slt package to view data usage,Crash/Freeze,2023-01-28 10:31:08,
the app has so many bugs when i went to pay my bill it wouldn t respond,Payment Issue,2023-08-24 15:22:39,
good app but sometimes it crashes,Crash/Freeze,2023-02-01 16:23:15,1.5.4
worst app ever doesn t send me any details despite requesting login change and also doesn t work well so disappointing,Login Error,2021-09-25 10:46:08,
mobile online payment gateway is not working please fix it couldn t pay the bills,Payment Issue,2024-11-25 08:05:58,2.0.6
most of the time this app shows an error when i try to check the data balance which reminds that i can t expect more than this from a government based internet connection with low skilled developers,Other,2023-02-02 21:21:16,1.6.0
long time i using this app for pay my bill but recently i cant pay using this app after all filing and say time out and not open otp sections why is that happen i pay other light and water there app has not that issue,Payment Issue,2022-05-26 15:15:03,1.4.2
very poor app most of the time it doesnt work they can t make proper app for their connection,Other,2023-05-29 22:58:34,1.6.1
hi i was buy a slt mobitel router four days ago but still i can t log into your app and see my data details i have try on web also but its impossible every time i try the app indicates adding erro please fix that,Login Error,2023-12-16 13:51:53,1.7.0
well the app is overall okay with me but the main issue that is visible to me right now is when most of the time i m about to login to the app and check my data balance and details there are messages shows up displaying service temporarily unavailable oops something went wrong please try again shortly and this really mess me up most of the time btw sometimes everything loads up but the data balance shows n a if you guys can change this i will change my review to 5star immediately,Login Error,2023-05-31 22:08:43,1.6.1
well the app is overall okay with me but the main issue that is visible to me right now is when most of the time i m about to login to the app and check my data balance and details there are messages shows up displaying service temporarily unavailable oops something went wrong please try again shortly and this really mess me up most of the time btw sometimes everything loads up but the data balance shows n a if you guys can change this i will change my review to 5star immediately,Login Error,2023-05-31 21:55:14,1.6.1
when a new version is available we are not allowed to use the existing version without updating when there is no space left in the phone to update the app is not usable at all,Update Issue,2022-01-16 09:43:09,
garbage 90 of the time this app shows a exclamation mark at the home screen it s not working specially at the end of the month so you can t unsubscribe from the addons,UI Issue,2021-06-01 07:53:56,1.3.2
useless after the update i connot login using old credential even customer care rep doesn t know about it,Login Error,2021-06-25 10:25:19,1.3.2
yesterday i paid my outstanding amount via online but still it has not been updated,Update Issue,2021-06-19 22:24:07,1.3.2
app must update bill payment details immediately we paid it,Payment Issue,2021-05-29 08:35:20,1.2.8
good but sometimes it crash and showing n a in data usage i think that is the only problem i think you will fix it soon asap,Crash/Freeze,2021-11-27 06:23:23,1.4.1
worst internet provider when we done a payment it s not updated on system ontime,Payment Issue,2023-04-28 02:21:09,1.6.1
no broadband usage working online payment not working bad app,Payment Issue,2020-12-25 17:25:37,1.0.6
app buttons are not working properly,UI Issue,2022-02-22 06:03:47,1.4.2
always stuck,Crash/Freeze,2023-02-02 10:29:51,1.6.0
one time payment method is now not available this is a hige miss in this app,Payment Issue,2022-08-18 08:55:46,1.4.2
requested fiber connection they never respond good customer service,Other,2021-06-17 21:50:21,1.3.2
useless app with useless staff created a complaint no action has been taken for once week when i try to create another one after 10 days it says already has one and updated but can t open the existing complaint,Update Issue,2023-02-17 13:22:24,1.6.0
very bad and useless app can t even log into it do not even install it it is a wastage of your data,Login Error,2021-09-27 13:49:31,1.3.2
can t update contact info this is a basic feature that any service provider app should have and it s broken or missing in myslt contact details are essential for receiving alerts and updates so not being able to change them is a serious flaw please fix this,Crash/Freeze,2025-04-16 08:56:30,2.1.0
worst app won t proceed further while trying to pay the bills please fix it,Payment Issue,2021-07-20 08:31:47,1.3.2
halfassed app cant do anything cant update info cant add an account cant even log in properly previous version was much better than this stupid app,Login Error,2022-08-28 17:06:07,1.4.2
this is regarding my slt fiber connection it is not working internet connection when starts my kids zoom lessons in morning i have enough data and i have added some more data to expect un intrupted service but the level is zero one of horrible worst fiber connection big talk s only,Other,2021-06-11 09:04:06,1.3.2
every time ask login stupid app very bad experience,Login Error,2021-10-22 11:37:51,1.4.1
still bill payment option is not working i thought that it might have corrected with this release but still it is same after entering details it goes to review page when i press the pay button there it goes back to the initial details entering page with empty fields tried several times failed i m wondering why the tech can t make a simple app that can make an online payment payment through the browser is also difficult due to a certificate issue very poor service by slt,UI Issue,2020-10-19 11:19:16,1.0.6
after updated payment option not better than before very difficult to make online payment,Payment Issue,2020-10-14 12:54:08,1.0.5
new update not support android 5 and downward please fix this because most peoples dont have expensive mobile phones,Update Issue,2021-06-26 15:32:36,1.3.2
bad experience very slow app,Slow Performance,2025-04-29 18:34:17,2.1.0
it was fine but for the past few days i haven t been able to update my contact details if that issue is fixed the app would be fine for me,Update Issue,2025-04-17 14:17:13,2.0.8
does not update the bill details in the latest update cannot even fulfill a basic requirement knew this was ganna when it got merged with the m,Payment Issue,2021-05-01 09:24:35,1.2.8
i download this app before month ago still can not login to this even slt servise center people dont know how to login to this app very poor service not recomend,Login Error,2021-08-14 19:26:02,1.3.2
very useless and broken app also why does it matter if i have a data balance in my broadband account if i want to make a complain releted to broadband via this app this app is a joke now it shows an update now message where there is no update available in playstore,Update Issue,2023-08-22 16:08:11,1.7.0
super but not update,Update Issue,2020-10-28 14:10:35,1.0.5
piece of trash app absolutely useless whenever an add on is about to expire the app conveniently crashes or displays couldn t load the user details package details so i have na way of telling if the add on is over and whether i m using add on data or standard data,UI Issue,2024-01-09 09:45:30,1.7.0
when i submit otp code the app says app requires a working internet connection which you don t have at the moment hey i was connected to my slt router at the moment which i used to download the app a few moments ago,Other,2021-05-15 08:41:32,1.2.8
user interface is horrible sometimes it bugs when i purchase extra gb needed to be upgraded,UI Issue,2022-10-07 01:26:58,1.4.2
worst app i have ever seen you can t login with your old credentials always says invalid username password most of the main options are not working like bills internet etc it has terrible ui ux and functionality is totally messed up why is the app even released to playstore if the functionalities are not complete,Login Error,2021-05-27 09:22:40,1.2.8
earlier it was ok now the bill payment is not working why the developers are not seen this kind of things people are mentioning earlier also about this just to develop the software is not enough it should be up to date i don t know why these guys are what doing on their office time,Payment Issue,2020-10-13 09:51:55,1.0.5
i m trying to add my broadband connection but its says try later what at what did i want to try to add my connection to slt selfcare,Other,2020-09-26 20:37:04,1.0.4
the user interface is very frustrating to use can t find my package details even,UI Issue,2024-06-30 20:06:17,1.8.0
so many errors even can t see the bills,Payment Issue,2020-12-01 07:39:57,1.0.6
does not update the payments accurately,Payment Issue,2024-06-16 07:36:09,1.8.0
it keeps getting crashed and not recommending the service also worst app ever used,Crash/Freeze,2021-09-05 20:04:44,1.3.2
wrost app ever can t even log in to my account this is more than a garbage please don t install this it s a waste of time,Login Error,2021-06-05 16:33:09,1.3.2
please enhance the complaint section in the app by providing a status of the complaint successful failed when i tried to file a complaint using this app it did not give any feedback nor returned to the previous state therefore i clicked the submit button multiple times which resulted in multiple complaints please fix this,UI Issue,2021-06-02 14:54:49,1.3.0
still unable to pay bills via this myslt app some features not properly done,Payment Issue,2022-11-26 12:35:59,1.5.4
this app never works correctly every time i open it something is not right sometimes some features are not available altogether or there s some kind of a error message that make no sense at all i guess the only thing slt care about thses days are collecting bills increasing charges,Payment Issue,2023-02-01 19:46:51,1.5.9
click more data usage display error please change the slt package for view data usage,UI Issue,2021-06-19 20:55:18,1.3.2
can t we use myslt app s credentials for logging in than to create a new account you already have our login details this is misleading,Login Error,2020-05-21 07:05:36,1.0.0
worst app ever getting unavailable service all the time and application keeps getting stuck i would encourage you to work on your mobile app next time rather than giving shakaboom packages,Crash/Freeze,2023-02-01 00:11:36,
the new update is better keep it up with your rapid development one missing functionality is to reload the checking usage of the remaining data percentage size i have to close the app from the task menu and reopen it again to check the remaining data or usage but the add on data or extra gb data are getting refreshed when i go back and click on the button again the above issue is making super frustrated sometimes please add the reload feature pull to refresh thanks,UI Issue,2023-08-10 10:41:17,1.7.0
please add reloading option to this app i cant to reload to my prepid slt connection,Slow Performance,2023-08-23 12:33:51,1.7.0
did you get an unpaid intern to make this probably not an intern could do a much better job the payment gateway is awful can t even get the basic account details from the profile that s logged in,Payment Issue,2023-05-16 20:27:30,1.6.1
what a poor connection,Other,2022-11-26 09:58:51,1.5.2
service is too late there are dropouts thrice in a month takes 3 or 4 days to get connection,Other,2021-09-14 09:23:07,
poor app most of the functions not worked well otp not received on time e bill also not received to email,Payment Issue,2024-12-07 15:29:40,2.0.6
worst app ever cannot check broadband usage even though there s a link to it it says to download slt broadband why should we download another app after downloading myslt we should be able to check everything from one app slt broadband has a bug and even after entering the correct password it says wrong password we have to enter the same password 10 15 times to log in useless as ever slt is boasting about their quality but they cannot even make a properly functioning app shame,Login Error,2021-01-08 16:04:20,
another ewaste by slt mobitel app crashed every time i open it on my android 13 device or it says service temporary unavailable app sucks and often not responds to what i do ios version is still in okay condition but android needs a huge update idk why this huge tech companies make such use less apps like this my dialog is also such an waste and a bad reputation for the companies expected more from them update please,Crash/Freeze,2024-05-21 20:09:40,
cannot clearly see the history of bill amounts,Payment Issue,2021-09-27 16:34:53,1.3.2
first of all you have to sort out why gating crash and very slow i am using myslt out of sl,Crash/Freeze,2021-09-03 09:07:15,1.3.2
one of the worst company took 12 hours to get my 4g lte connection i have mailed so many times and this is a kind of time wastage,Other,2021-01-07 20:46:36,1.0.6
app bill details app developing zero,Payment Issue,2020-11-24 10:58:31,1.0.6
i paid for a fiber connection a week ago but still they have been unable to give the connection when i try to contact the responsible people they don t answer calls not recommend slt to anyone,Other,2024-10-16 17:35:14,2.0.2
poor app i failed to even sign up cause this stupid app keep saying i don t have working internet while i do,Payment Issue,2021-04-06 21:55:14,1.0.9
when i need to use you must offer to proceed without updating the app update should be optional not a must it cannot update with slow connections,Slow Performance,2021-10-11 20:27:14,1.3.2
horrible service and horrible app displays wrong information inaccurate data balance,UI Issue,2020-04-25 17:12:45,
it cant even pay bills,Payment Issue,2021-04-14 16:29:50,
worst app ever always service temporary unavailable or something thing wait wrong and also internet connection is the worst internet service provider,Slow Performance,2023-05-26 19:27:18,1.6.1
bad service 2 internet wada na complain damma damma eth na,Other,2022-08-07 21:04:55,1.4.2
one of the worst telecommunication provider telephone internet and peo tv connections were out of order since 2022 08 23 morning and complaint made at 6 43 am now its 9 20pm still the stupid technicians couldnt fix the problem i don t know why the company pay thees unskilled technicians missed the online classes of my kids had to postpone many work that i had to do cant watch the television is this the service you provide,Other,2022-08-23 21:24:22,1.4.2
very poor customer service and online payment portable repeatedly asking for information that we have already provided when we inquire about it no reply for weeks,Payment Issue,2022-09-11 09:47:27,1.4.2
useless app wrong bill details,Payment Issue,2021-06-12 21:35:40,1.3.2
connection change dropdown is not visible at the top,Crash/Freeze,2022-10-22 18:08:12,1.5.2
slt fibre wifi speed is low since oct 2024,Other,2024-10-17 21:57:07,2.0.2
a totally horrible app i did my bill payment everytime with the app but today i paid my bill but there s no otp or any privacy for the debit card payment it only says the transaction successful but when i check my last bill there s no update i checked with the slt customer service and they also not updated about the last transaction i m lucky to have the transaction id otherwise they will not believe,Payment Issue,2022-09-16 08:19:38,
a connection with a very weak internet service provider very sad contributor a relationship where the bill pays no valuable service,Payment Issue,2021-05-27 21:46:51,1.3.0
their connection speed gets so low due to higher user base so they can t have new users network speeds are so low that 3 seconds of hd video loads for 30 seconds and after thst 3 seconds it buffers for anlther 30 seconds,Other,2024-04-11 17:33:26,1.7.0
can t even change contact information edit the dev team behind this app have to be the most incompetent team of software devs on any app it s been a month and a half and they still haven t fixed the issue nice job,Crash/Freeze,2025-05-07 08:19:27,2.1.0
worst if i do not want to update now why do u push me worst experience,Update Issue,2023-01-27 23:13:37,1.5.4
whats the slt account number i have to enter i tried the phone connection number but it says incorrect,Other,2020-11-03 20:09:05,1.0.6
horrible app very slow have to wait like more than 15 min to see the data balance and to add extra gb please correct this don t check your valuable customer s patience,Slow Performance,2021-05-31 16:53:48,1.3.2
always say no internet or invalid username,Other,2020-12-24 21:27:54,1.0.6
a useless app with no updates and most of the links are not working tried removing and re installing with the same experience made a complaint but they have no clue whatvs wrong with their app,Update Issue,2025-05-06 00:29:40,
previous app is 1000 times better thani this that app was not worked today and i installed this app but this app is not really working well today i tried to add extra 3gb for my router and the add to bill command is not response worst app and further more i tried it for like 100th time and finally i got my extra gb,Payment Issue,2021-08-25 10:19:07,1.3.2
i ve been trying to update my email on the myslt app for nearly two months and every time i get the same message service temporarily unavailable it s beyond frustrating on top of that i no longer receive my monthly bill via email which makes things even more inconvenient this is a basic feature that should work properly and it s disappointing that slt hasn t fixed it after all this time please prioritize your users and sort these issues out,Payment Issue,2025-05-02 11:00:54,2.1.0
the worst app ever cant use the login or reset using forgot pwd option i installed this long time back removed since it was useless but installed this again only because slt said they ll discontinue the broadband app but sad to say no improvement at all used the google id to login but cant even add a connection the fact that such a defunct app is still listed in the playstore under slt brand is so damn unbelievable who are taking such poor decisions at slt,Login Error,2022-06-12 19:39:39,
you might say something like this app is consistently unreliable often displaying temporary service unavailable messages it seems like the developers haven t put in enough effort making it a waste of time please avoid this app,UI Issue,2024-09-13 13:40:18,1.8.0
now a days your wife connection is very slow,Slow Performance,2021-05-19 21:26:17,1.2.8
fail app,Payment Issue,2020-11-28 23:17:16,1.0.6
wanted i upgrade my internet package they promising that the app will provode efficient service but my request is still inprogress and now i cannot upgrade it by calling the call center they are saying that i need to wait because i have already requested it via my slt app nonsense,Slow Performance,2022-05-18 10:34:03,1.4.2
does absolutely nothing useful app s servers are down all the time cannot even view the bill or usage what even is the app for,Payment Issue,2024-04-16 06:04:35,1.7.0
one of the most useless apps ever used no way to contact support always displays inaccurate amount of gb amount,UI Issue,2020-04-13 12:48:42,
please make it more efficient app is not loading properly,Slow Performance,2023-05-30 19:57:15,1.6.1
as i wanted to pay my slt telephone bills from home via online i installed this myslt app last week since then i am trying many times to sign in to the app which is made necessary but to my dismay i was unable to do it due to faults of this app every time i try it and enter the required otp number which is sent to my email your message shows that it is wrong sometimes your message say that service is temporarily unavailable how can i get your service pay my bills i am disappointed,Login Error,2021-07-06 04:28:37,1.3.2
not user friendly cannot login previous app has been discontinued without informing the customer promptly painful experience,Login Error,2022-07-29 22:13:41,1.4.2
8000 lkr charged as romaing data usage while my phone turned off everyone please check bills properly these are bunch of thieves,Payment Issue,2021-08-06 08:01:48,1.3.2
very poor connection rude with customers cheating packages poor customer service they consider only about money,Other,2021-05-31 10:11:57,
always shows errors,Other,2025-04-10 14:15:09,
i ve been trying to enter my account for multiple time but it is still showing errors very poor build up,Other,2021-06-26 00:28:30,
can t log my stl account always says please try again later,Other,2021-06-20 07:41:41,1.3.2
i cant log also why dont u fix any,Other,2022-01-26 08:26:22,1.4.2
pleas fix that error ops smthing went wrong this message pops when ever i launch the app,Other,2024-01-05 15:32:25,1.7.0
not working properly always shows an error prompt when opened p s now there is no such an error still there is room to improve but overall it s usable,Other,2022-07-03 03:58:20,1.4.2
i can t register every time i try it says try again,Other,2021-12-04 19:13:14,1.4.1
error error error invalid password why you cannot make a app correctly,Other,2021-06-26 14:36:42,1.3.2
can t add a new account all details are correct but receiving a error,Other,2022-07-28 19:19:20,1.4.2
not working signup always showing error slt website also same,Other,2024-10-11 22:53:32,2.0.2
not working in my nokia 7 plus everytime show error,Other,2021-06-06 23:00:36,1.3.2
it s says cannot install,Other,2022-10-28 20:35:27,
bug bug bug,Other,2021-06-01 07:59:54,
can t even launch a stable app,Other,2020-05-22 11:36:07,1.0.0
did not receive otp in forgot my password then got an error message saying null,Other,2021-12-01 23:12:37,
error,Other,2023-02-03 17:23:10,1.6.0
unable to link my account stating some error occoured pls chk,Other,2020-05-21 00:53:30,1.0.0
everytime it get errors,Other,2023-01-31 14:41:10,1.5.9
errors errors errors,Other,2025-04-12 22:35:42,2.0.8
i have an ongoing complain that submitted last year they fixed the error but the complain still exist i cant submit a new complain because of it,Other,2023-05-20 17:35:08,1.6.1
unable to sync my broadband account error message saying the service is temporary unavailable totally unusable,Other,2020-07-02 10:02:57,1.0.0
unable to download the app,Other,2022-07-10 18:39:44,1.4.2
